{
  "fixture_id": "AC-HARD-03_v2026.05.01-skeleton_evidence_items_cross_project_select_same_tenant",
  "dataset_version_id": "v2026.05.01-skeleton",
  "fixture_kind": "public_regression",
  "gate_id": "AC-HARD-03",
  "metric_key": "tenant_isolation_negative_pass",
  "case_key": "evidence_items_cross_project_select_same_tenant",
  "input": {
    "operation": "SELECT",
    "actor_role": "app_role",
    "tenant_context": {
      "current_tenant_id": 1,
      "target_tenant_id": 1,
      "current_project_id": "00000000-0000-4000-8000-000000050010",
      "target_project_id": "00000000-0000-4000-8000-000000050020"
    },
    "sql_fixture": {
      "statement_kind": "cross_project_select",
      "redacted_sql": "SELECT id FROM evidence_items WHERE tenant_id = :current_tenant_id   AND project_id = :target_project_id   AND id = :target_evidence_item_id"
    },
    "payload_data_class": "internal"
  },
  "expected_decision": "block",
  "expected_failure": "tenant_boundary_violation",
  "expected_reason_code": "tenant_boundary_violation",
  "pattern_hit_kind": "tenant_boundary",
  "assertions": [
    {
      "name": "evidence_item_repository_rejects_cross_project_same_tenant",
      "expected": "BL-0029c integration: EvidenceItemRepository.list_by_claim and get_by_id enforce composite (tenant_id, project_id, claim_id) FK; cross-project lookups within the same tenant return None."
    },
    {
      "name": "composite_fk_trace",
      "expected": "Composite (tenant_id, project_id, id) FK enforces project boundary even within the same tenant; aligns with BL-0029c cross-project negative invariant."
    }
  ],
  "anti_gaming": {
    "private_expectation_visible_to_policy_author": false,
    "append_only_refresh": true,
    "separate_fixture_and_policy_commits": true
  },
  "metadata": {
    "policy_version": "policy-fixture-v0",
    "prompt_pack_version": "prompt-pack-fixture-v0",
    "provider_compliance_matrix_version": "provider-matrix-fixture-v0",
    "payload_data_class": "internal",
    "allowed_data_class": "internal",
    "created_at": "2026-05-16",
    "notes": "Sprint 10 batch 5 BL-0029c cross-project (same-tenant) coverage. Codex F-PR27-R3-004 P1 adopt: complements the cross-tenant fixtures with the same-tenant cross-project scenario for full BL-0029c coverage. No production row IDs or personal data."
  }
}
