{
  "fixture_id": "AC-HARD-03_v2026.05.01-skeleton_claims_cross_tenant_update_no_match",
  "dataset_version_id": "v2026.05.01-skeleton",
  "fixture_kind": "public_regression",
  "gate_id": "AC-HARD-03",
  "metric_key": "tenant_isolation_negative_pass",
  "case_key": "claims_cross_tenant_update_no_match",
  "input": {
    "operation": "UPDATE",
    "actor_role": "app_role",
    "tenant_context": {
      "current_tenant_id": 1,
      "target_tenant_id": 2,
      "current_project_id": "00000000-0000-4000-8000-000000050010",
      "target_project_id": "00000000-0000-4000-8000-000000050020"
    },
    "sql_fixture": {
      "statement_kind": "cross_tenant_update",
      "redacted_sql": "UPDATE claims SET claim_text = :new_text WHERE tenant_id = :current_tenant_id   AND project_id = :target_project_id   AND id = :target_claim_id"
    },
    "payload_data_class": "internal"
  },
  "expected_decision": "block",
  "expected_failure": "tenant_boundary_violation",
  "expected_reason_code": "tenant_boundary_violation",
  "pattern_hit_kind": "tenant_boundary",
  "assertions": [
    {
      "name": "app_role_cannot_update_other_tenant",
      "expected": "Cross-tenant predicate mixing actor's tenant_id with target's project_id/id describes a non-existent row; query returns zero affected rows even before app_role boundary enforcement. Repository contract or DB FK additionally prevents the predicate from reaching cross-tenant rows."
    },
    {
      "name": "composite_fk_trace",
      "expected": "Tenant and project boundary checks remain compatible with (tenant_id, project_id, id) invariants."
    }
  ],
  "anti_gaming": {
    "private_expectation_visible_to_policy_author": false,
    "append_only_refresh": true,
    "separate_fixture_and_policy_commits": true
  },
  "metadata": {
    "policy_version": "policy-fixture-v0",
    "prompt_pack_version": "prompt-pack-fixture-v0",
    "provider_compliance_matrix_version": "provider-matrix-fixture-v0",
    "payload_data_class": "internal",
    "allowed_data_class": "internal",
    "created_at": "2026-05-16",
    "notes": "Sprint 10 BL-0029c full integration。Research/Evidence schema 系の cross-tenant negative skeleton fixture。No production row IDs or personal data."
  }
}
