{
  "fixture_id": "AC-HARD-03_v2026.05.01-skeleton_evidence_sources_cross_tenant_select_app_role",
  "dataset_version_id": "v2026.05.01-skeleton",
  "fixture_kind": "public_regression",
  "gate_id": "AC-HARD-03",
  "metric_key": "tenant_isolation_negative_pass",
  "case_key": "evidence_sources_cross_tenant_select_app_role",
  "input": {
    "operation": "SELECT",
    "actor_role": "app_role",
    "tenant_context": {
      "current_tenant_id": 1,
      "target_tenant_id": 2,
      "current_project_id": 10,
      "target_project_id": 20
    },
    "sql_fixture": {
      "statement_kind": "cross_tenant_select",
      "redacted_sql": "SELECT id FROM evidence_sources WHERE tenant_id = :target_tenant_id AND id = :target_evidence_source_id"
    },
    "payload_data_class": "internal"
  },
  "expected_decision": "block",
  "expected_failure": "tenant_boundary_violation",
  "expected_reason_code": "tenant_boundary_violation",
  "pattern_hit_kind": "tenant_boundary",
  "assertions": [
    {
      "name": "app_role_cannot_read_other_tenant_source",
      "expected": "EvidenceSource reads are tenant-scoped and must not expose rows from target_tenant_id."
    },
    {
      "name": "tenant_scoped_source_is_not_project_scoped",
      "expected": "The fixture preserves the ADR boundary that evidence_sources have no project_id column."
    },
    {
      "name": "canonical_url_not_disclosed",
      "expected": "The public regression case uses a redacted SQL skeleton and no real source URLs."
    }
  ],
  "anti_gaming": {
    "private_expectation_visible_to_policy_author": false,
    "append_only_refresh": true,
    "separate_fixture_and_policy_commits": true
  },
  "metadata": {
    "policy_version": "policy-fixture-v0",
    "prompt_pack_version": "prompt-pack-fixture-v0",
    "provider_compliance_matrix_version": "provider-matrix-fixture-v0",
    "payload_data_class": "internal",
    "allowed_data_class": "internal",
    "created_at": "2026-05-16",
    "notes": "Sprint 10 BL-0029c full integration。Research/Evidence schema 系の cross-tenant negative skeleton fixture。No production row IDs or personal data."
  }
}
