{
  "fixture_id": "AC-HARD-03_v2026.05.16-sprint10-batch5_claims_cross_tenant_insert_composite_fk",
  "dataset_version_id": "v2026.05.16-sprint10-batch5",
  "fixture_kind": "public_regression",
  "gate_id": "AC-HARD-03",
  "metric_key": "tenant_isolation_negative_pass",
  "case_key": "claims_cross_tenant_insert_composite_fk",
  "input": {
    "operation": "INSERT",
    "actor_role": "app_role",
    "tenant_context": {
      "current_tenant_id": 1,
      "target_tenant_id": 2,
      "current_project_id": 10,
      "target_project_id": 20
    },
    "sql_fixture": {
      "statement_kind": "cross_tenant_insert_composite_fk",
      "redacted_sql": "INSERT INTO claims (tenant_id, project_id, research_task_id, claim_text, provenance_json) VALUES (:current_tenant_id, :target_project_id, :target_research_task_id, :claim_text, :redacted_provenance_json)"
    },
    "payload_data_class": "internal"
  },
  "expected_decision": "block",
  "expected_failure": "tenant_boundary_violation",
  "expected_reason_code": "tenant_boundary_violation",
  "pattern_hit_kind": "tenant_boundary",
  "assertions": [
    {
      "name": "claims_research_task_composite_fk_blocks_cross_tenant_parent",
      "expected": "The claims research_task composite FK rejects parent tasks outside the inserted tenant/project boundary."
    },
    {
      "name": "project_id_must_belong_to_tenant",
      "expected": "A target_project_id from another tenant cannot be combined with current_tenant_id for claim insertion."
    },
    {
      "name": "server_owned_metadata_remains_required",
      "expected": "The negative fixture assumes repository-owned metadata and does not rely on caller-supplied boundary fields."
    }
  ],
  "anti_gaming": {
    "private_expectation_visible_to_policy_author": false,
    "append_only_refresh": true,
    "separate_fixture_and_policy_commits": true
  },
  "metadata": {
    "policy_version": "policy-fixture-v0",
    "prompt_pack_version": "prompt-pack-fixture-v0",
    "provider_compliance_matrix_version": "provider-matrix-fixture-v0",
    "payload_data_class": "internal",
    "allowed_data_class": "internal",
    "created_at": "2026-05-16",
    "notes": "Sprint 10 BL-0029c full integration。Research/Evidence schema 系の cross-tenant negative skeleton fixture。No production row IDs or personal data."
  }
}
