{
  "fixture_id": "AC-HARD-03_v2026.05.01-skeleton_evidence_items_cross_tenant_select_app_role",
  "dataset_version_id": "v2026.05.01-skeleton",
  "fixture_kind": "public_regression",
  "gate_id": "AC-HARD-03",
  "metric_key": "tenant_isolation_negative_pass",
  "case_key": "evidence_items_cross_tenant_select_app_role",
  "input": {
    "operation": "SELECT",
    "actor_role": "app_role",
    "tenant_context": {
      "current_tenant_id": 1,
      "target_tenant_id": 2,
      "current_project_id": "00000000-0000-4000-8000-000000050010",
      "target_project_id": "00000000-0000-4000-8000-000000050020"
    },
    "sql_fixture": {
      "statement_kind": "cross_tenant_select",
      "redacted_sql": "SELECT id FROM evidence_items WHERE tenant_id = :target_tenant_id AND project_id = :target_project_id AND id = :target_evidence_item_id"
    },
    "payload_data_class": "internal"
  },
  "expected_decision": "block",
  "expected_failure": "tenant_boundary_violation",
  "expected_reason_code": "tenant_boundary_violation",
  "pattern_hit_kind": "tenant_boundary",
  "assertions": [
    {
      "name": "app_role_cannot_read_other_tenant_evidence_item",
      "expected": "EvidenceItem repository reads must be scoped by current tenant/project before returning evidence rows."
    },
    {
      "name": "claim_binding_stays_project_scoped",
      "expected": "Evidence items remain tied to claims through the tenant_id, project_id, claim_id composite FK."
    },
    {
      "name": "source_tenant_scope_does_not_weaken_project_scope",
      "expected": "Tenant-scoped evidence_sources do not allow evidence_items to escape claim/project boundaries."
    }
  ],
  "anti_gaming": {
    "private_expectation_visible_to_policy_author": false,
    "append_only_refresh": true,
    "separate_fixture_and_policy_commits": true
  },
  "metadata": {
    "policy_version": "policy-fixture-v0",
    "prompt_pack_version": "prompt-pack-fixture-v0",
    "provider_compliance_matrix_version": "provider-matrix-fixture-v0",
    "payload_data_class": "internal",
    "allowed_data_class": "internal",
    "created_at": "2026-05-16",
    "notes": "Sprint 10 BL-0029c full integration。Research/Evidence schema 系の cross-tenant negative skeleton fixture。No production row IDs or personal data."
  }
}
